{
  "$schema": "https://json-schema.org/draft/2020-12/schema",
  "$id": "fast-as-50/proposal.schema.json",
  "title": "data/proposals/<id>.json — forslag til plan.json (blok 9)",
  "description": "Kontrakt jf. blok9-spec §1. set_day (blok 9), set_week_targets (ctl-recalib, 14/9-2026) og set_goals (kropsmål, 27/10-2026). Anvendes via edit_apply.apply_edit(action='apply_proposal'). additionalProperties: true.",
  "type": "object",
  "required": ["id", "title", "status", "changes"],
  "additionalProperties": true,
  "properties": {
    "id": {"type": "string", "minLength": 1, "pattern": "^[A-Za-z0-9][A-Za-z0-9._-]*$"},
    "createdAt": {"type": ["string", "null"]},
    "createdBy": {"type": "string"},
    "title": {"type": "string"},
    "note": {"type": "string"},
    "summary": {"type": "array", "items": {"type": "string"}},
    "status": {"type": "string", "enum": ["pending", "accepted", "rejected", "applied-offline"]},
    "decidedAt": {"type": ["string", "null"]},
    "result": {"type": ["object", "null"], "additionalProperties": true},
    "changes": {
      "type": "array",
      "items": {
        "oneOf": [
          {"$ref": "#/$defs/setDay"},
          {"$ref": "#/$defs/setWeekTargets"},
          {"$ref": "#/$defs/setGoals"}
        ]
      }
    }
  },
  "$defs": {
    "setDay": {
          "type": "object",
          "required": ["date", "action", "entries"],
          "additionalProperties": true,
          "properties": {
            "date": {"type": "string", "pattern": "^\\d{4}-\\d{2}-\\d{2}$"},
            "action": {"type": "string", "enum": ["set_day"]},
            "time": {"description": "Starttid (27/9-2026) -> timeOverrides: [h, m], {disciplin: [h, m]} eller null",
                     "type": ["array", "object", "null"]},
            "entries": {
              "type": "array",
              "items": {
                "type": "object",
                "required": ["workout"],
                "additionalProperties": true,
                "properties": {
                  "workout": {"type": ["object", "null"], "required": ["name", "type"], "additionalProperties": true,
                              "properties": {"name": {"type": "string"}, "type": {"type": "string"},
                                             "moving_time": {"type": "integer"}, "description": {"type": "string"}}},
                  "libraryId": {"type": "string"},
                  "templateId": {"type": "string"},
                  "note": {"type": ["string", "null"]},
                  "optional": {"type": "boolean"}
                }
              }
            }
          }
        },
    "setWeekTargets": {
      "type": "object",
      "description": "CTL-rekalibrering (14/9-2026): ugemål i et program. Ingen dato, ingen sync.",
      "required": ["action", "programId", "week"],
      "additionalProperties": true,
      "properties": {
        "action": {"type": "string", "enum": ["set_week_targets"]},
        "programId": {"type": "string"},
        "week": {"type": "integer", "minimum": 1},
        "ctlTarget": {"type": "integer", "minimum": 0},
        "tssTarget": {"type": "integer", "minimum": 0}
      }
    },
    "setGoals": {
      "type": "object",
      "description": "Kropsmål pr. program (27/10-2026). Ingen dato, ingen sync.",
      "required": ["action", "programId", "goals"],
      "additionalProperties": true,
      "properties": {
        "action": {"type": "string", "enum": ["set_goals"]},
        "programId": {"type": "string"},
        "goals": {
          "type": "object",
          "minProperties": 1,
          "additionalProperties": false,
          "properties": {
            "weightKg": {"type": "number", "minimum": 40, "maximum": 150},
            "bodyFatPct": {"type": "number", "minimum": 3, "maximum": 50}
          }
        }
      }
    }
  }
}
