{
  "changes": [
    {
      "action": "set_goals",
      "goals": {
        "bodyFatPct": 19,
        "weightKg": 69.5
      },
      "programId": "tds-2027"
    }
  ],
  "createdAt": "2026-10-27T16:05:00+00:00",
  "createdBy": "claude",
  "id": "2026-10-27-mal-1-januar",
  "note": "Kennet 27/10: 68 kg / 16 % til 31/1 er ikke realistisk efter virus (72,0 kg / 22,2 %). Mål: under 70 kg til 1/1 med 3 kg mindre fedt og muskelmasse holdt. Gennemgås med Martin 19/11.",
  "status": "accepted",
  "summary": [
    "Vægtmål 68 → 69,5 kg",
    "Fedtmål 16 → 19 %",
    "Gennemgås igen med Martin 19/11"
  ],
  "title": "Nyt kropsmål: 69,5 kg / 19 % til 1/1",
  "decidedAt": "2026-10-27T15:52:23+00:00",
  "result": {
    "dates_changed": [],
    "commit": "305cb322559b742cc712f6c6d2f209e515ef3c9f"
  }
}
