{
  "changes": [
    {
      "action": "set_day",
      "date": "2026-09-15",
      "entries": [
        {
          "id": "86a116af",
          "note": "Sub 1:30-åbner: 4×3 min på 4:12-4:18. Stop efter 3 reps hvis benene ikke er der efter Médoc",
          "workout": {
            "description": "- Varm-op 15m >5:39/km Pace\n\n4x\n- Racepace 3m 4:12-4:18/km Pace\n- Jog 2m >5:39/km Pace\n\n- Cool-down 10m >5:39/km Pace\n\nMålpace til sub 1:30 = 4:15/km. Kun 4 reps — 10 dage efter maraton. Kør jævnt, ikke hårdere end 4:12. Føles det tungt, så stop efter rep 3.",
            "moving_time": 2700,
            "name": "Løb 4×3 min racepace 4:12-4:18/km (sub 1:30-åbner)",
            "type": "Run",
            "workout_doc": {
              "steps": [
                {
                  "duration": 900,
                  "pace": {
                    "end": 78,
                    "start": 65,
                    "units": "%pace"
                  },
                  "text": "Varm-op >5:39/km"
                },
                {
                  "reps": 4,
                  "steps": [
                    {
                      "duration": 180,
                      "pace": {
                        "end": 105,
                        "start": 102,
                        "units": "%pace"
                      },
                      "text": "Racepace 4:12-4:18/km"
                    },
                    {
                      "duration": 120,
                      "pace": {
                        "end": 78,
                        "start": 65,
                        "units": "%pace"
                      },
                      "text": "Jog >5:39/km"
                    }
                  ],
                  "text": "4x"
                },
                {
                  "duration": 600,
                  "pace": {
                    "end": 78,
                    "start": 65,
                    "units": "%pace"
                  },
                  "text": "Cool-down >5:39/km"
                }
              ]
            }
          }
        }
      ]
    },
    {
      "action": "set_day",
      "date": "2026-09-17",
      "entries": [
        {
          "id": "bf4bc1fa",
          "note": "Følingstest: 8 min på 4:15 skal føles kontrolleret. Ellers justér målet søndag",
          "workout": {
            "description": "- Let løb 15m >5:39/km Pace\n- Racepace 8m 4:12-4:18/km Pace\n- Let løb 8m >5:39/km Pace\n\n4x\n- Stride 20 sek (racesko) 1m freeride\n- Jog 40 sek 1m freeride\n\n- Cool-down 5m >5:39/km Pace\n\nSidste pas i racesko. 8 min på 4:15 er en følingstest, ikke træning — det skal føles kontrolleret. Gør det ikke, så er 4:15 for hurtigt søndag.",
            "moving_time": 2400,
            "name": "Løb let 40 min + 8 min racepace + 4 strides",
            "type": "Run",
            "workout_doc": {
              "steps": [
                {
                  "duration": 900,
                  "pace": {
                    "end": 78,
                    "start": 65,
                    "units": "%pace"
                  },
                  "text": "Let løb >5:39/km"
                },
                {
                  "duration": 480,
                  "pace": {
                    "end": 105,
                    "start": 102,
                    "units": "%pace"
                  },
                  "text": "Racepace 4:12-4:18/km"
                },
                {
                  "duration": 480,
                  "pace": {
                    "end": 78,
                    "start": 65,
                    "units": "%pace"
                  },
                  "text": "Let løb >5:39/km"
                },
                {
                  "reps": 4,
                  "steps": [
                    {
                      "duration": 60,
                      "text": "Stride 20 sek (racesko)"
                    },
                    {
                      "duration": 60,
                      "text": "Jog 40 sek"
                    }
                  ],
                  "text": "4x"
                },
                {
                  "duration": 300,
                  "pace": {
                    "end": 78,
                    "start": 65,
                    "units": "%pace"
                  },
                  "text": "Cool-down >5:39/km"
                }
              ]
            }
          }
        }
      ]
    },
    {
      "action": "set_day",
      "date": "2026-09-18",
      "entries": [
        {
          "note": "Kort og let. Benene sparet",
          "workout": {
            "description": "- 300m varm-op Z1 7m freeride\n\n4x\n- 100m teknik Z2 2m freeride\n\n\n6x\n- 100m let Z2 2m freeride\n- 30s pause 1m freeride\n\n- 200m cool Z1 5m freeride\n\n1500m, alt let. Kortere end planlagt — ingen træthed to dage før et A-forsøg.",
            "moving_time": 2400,
            "name": "Svøm 1500m let",
            "type": "Swim",
            "workout_doc": {
              "steps": [
                {
                  "duration": 420,
                  "text": "300m varm-op Z1"
                },
                {
                  "reps": 4,
                  "steps": [
                    {
                      "duration": 120,
                      "text": "100m teknik Z2"
                    }
                  ],
                  "text": "4x"
                },
                {
                  "reps": 6,
                  "steps": [
                    {
                      "duration": 120,
                      "text": "100m let Z2"
                    },
                    {
                      "duration": 60,
                      "text": "30s pause"
                    }
                  ],
                  "text": "6x"
                },
                {
                  "duration": 300,
                  "text": "200m cool Z1"
                }
              ]
            }
          }
        }
      ]
    },
    {
      "action": "set_day",
      "date": "2026-09-20",
      "entries": [
        {
          "id": "2d868f45",
          "note": "Sub 1:30-forsøg, 4:15/km. Bail-out ved 10 km: senere end 42:45 → 4:30/km. Gel 7 + 14 km",
          "workout": {
            "description": "- 0-5 km: 4:17-4:20/km 22m 4:17-4:20/km Pace\n- 5-15 km: 4:13-4:16/km 42m 4:13-4:16/km Pace\n- 15-21,1 km: 4:10-4:15 efter benene 26m 4:10-4:15/km Pace\n\nMÅL: sub 1:30 (4:15/km snit, 1:29:30). Tærskel er 4:24 — du løber over tærskel i 90 min, 15 dage efter Médoc. Det er et bevidst risikoløb.\nBAIL-OUT: passér 10 km senere end 42:45 eller RPE 8+ ved 10 km → skift til 4:30/km og red dagen (~1:33). Ingen hero-split de sidste 5 km medmindre benene siger ja ved 15 km.\nRacesko. Gel ved 7 km og 14 km. Opvarmning 12 min let + 4 strides. Cut starter først mandag 21/9.",
            "moving_time": 5400,
            "name": "CPH HALF — 21,1 km, sub 1:30-forsøg 4:15/km",
            "type": "Run",
            "workout_doc": {
              "steps": [
                {
                  "duration": 1320,
                  "text": "0-5 km 4:17-4:20/km"
                },
                {
                  "duration": 2520,
                  "text": "5-15 km 4:13-4:16/km"
                },
                {
                  "duration": 1560,
                  "text": "15-21,1 km 4:10-4:15 efter benene"
                }
              ]
            }
          }
        }
      ]
    }
  ],
  "createdAt": "2026-09-13T06:00:00Z",
  "createdBy": "claude",
  "id": "2026-09-13-uge38-sub130",
  "note": "Kennet vil gå efter sub 1:30 og tager risikoen bevidst (tærskel 4:24, 15 dage efter Médoc). Åbner tirsdag og følingstest torsdag lægges på racepace, svøm fredag kortes, race-pacing og bail-out-regel skrives om. %pace rettet: 4:12-4:18 = 102-105 % af tærskelfart (det gamle pas havde 101-105 % for 4:35-4:45, som reelt er 93-96 %).",
  "status": "accepted",
  "summary": [
    "Tir 15/9: 4×3 min på 4:12-4:18 (før 4:35-4:45)",
    "Tor 17/9: 40 min let + 8 min racepace + 4 strides",
    "Fre 18/9: svøm 1500m i stedet for 2000m",
    "Søn 20/9: sub 1:30, 4:17-4:20 / 4:13-4:16 / efter benene; bail-out ved 10 km > 42:45"
  ],
  "title": "Uge 38: CPH Half som sub 1:30-forsøg (4:15/km) i stedet for B-løb 4:35-4:45",
  "decidedAt": "2026-09-13T05:51:13+00:00",
  "result": {
    "dates_changed": [
      "2026-09-15",
      "2026-09-17",
      "2026-09-18",
      "2026-09-20"
    ],
    "commit": "d9d26b384ca3453019c6b6c6c8ceb93a2ed8223b"
  }
}
