{
  "changes": [
    {
      "action": "set_day",
      "date": "2026-09-22",
      "entries": [
        {
          "id": "a7c3e912",
          "note": "Stive ben efter CPH Half — gåtur i stedet for cykel",
          "workout": {
            "description": "- Gåtur 45m\n\nFORMÅL: Aktiv restitution. Roligt tempo, løs i benene.",
            "moving_time": 2700,
            "name": "Gåtur 45 min",
            "type": "Walk"
          }
        }
      ]
    },
    {
      "action": "set_day",
      "date": "2026-09-23",
      "entries": [
        {
          "id": "49dbc85c",
          "libraryId": "z2_grundtur_80",
          "note": "Flyttet fra lør 26/9. Let Z2 — stop hvis benene protesterer",
          "workout": {
            "description": "- Varm-op 10m ramp 45-62% FTP\n- Zone 2 25m 66% FTP\n- Kadence 100 5m 70% FTP @ 100 rpm\n- Zone 2 25m 66% FTP\n- Kadence 100 5m 70% FTP @ 100 rpm\n- Cool-down 10m ramp 62-40% FTP\n\nFORMÅL: Ren zone 2. Skal føles kedeligt. Fundamentet under alt andet — og den enkeltfaktor der bedst forudsiger hvor lidt VO2max falder med alderen.",
            "moving_time": 4800,
            "name": "FaF 1 Z2 - Grundtur 80",
            "type": "Ride",
            "workout_doc": {
              "steps": [
                {
                  "duration": 600,
                  "power": {
                    "end": 62,
                    "start": 45,
                    "units": "%ftp"
                  },
                  "ramp": true,
                  "text": "Varm-op",
                  "warmup": true
                },
                {
                  "duration": 1500,
                  "power": {
                    "end": 66,
                    "start": 66,
                    "units": "%ftp"
                  },
                  "text": "Zone 2 66% FTP"
                },
                {
                  "cadence": {
                    "end": 100,
                    "start": 100,
                    "units": "rpm"
                  },
                  "duration": 300,
                  "power": {
                    "end": 70,
                    "start": 70,
                    "units": "%ftp"
                  },
                  "text": "Kadence 100 70% FTP"
                },
                {
                  "duration": 1500,
                  "power": {
                    "end": 66,
                    "start": 66,
                    "units": "%ftp"
                  },
                  "text": "Zone 2 66% FTP"
                },
                {
                  "cadence": {
                    "end": 100,
                    "start": 100,
                    "units": "rpm"
                  },
                  "duration": 300,
                  "power": {
                    "end": 70,
                    "start": 70,
                    "units": "%ftp"
                  },
                  "text": "Kadence 100 70% FTP"
                },
                {
                  "cooldown": true,
                  "duration": 600,
                  "power": {
                    "end": 40,
                    "start": 62,
                    "units": "%ftp"
                  },
                  "ramp": true,
                  "text": "Cool-down"
                }
              ]
            }
          }
        }
      ]
    },
    {
      "action": "set_day",
      "date": "2026-09-24",
      "entries": [
        {
          "id": "437c99b0",
          "note": "AEROB PROBE (løb) — samme rute, 5:15/km, notér snit-puls · Flyttet fra ons 23/9 (stive ben)",
          "workout": {
            "description": "- Varm-op 10m >5:39/km Pace\n- PROBE 5 km @ 5:15/km FAST — samme rute hver gang 26m 5:15/km Pace\n- Base 4m 5:00-5:38/km Pace\n- Cool-down 5m >5:39/km Pace\n\nPROBEN ER MÅLINGEN. Samme flade rute, samme 5:15/km, samme tid på dagen. Notér gennemsnitspuls for de 5 km.\nLavere puls end sidste måned = bedre form. Højere = træthed eller for stort underskud.\nBlæst og over 22 grader ugyldiggør målingen — flyt den.",
            "moving_time": 2700,
            "name": "AEROB PROBE + Løb Z2 45 min",
            "type": "Run",
            "workout_doc": {
              "steps": [
                {
                  "duration": 600,
                  "pace": {
                    "end": 78,
                    "start": 65,
                    "units": "%pace"
                  },
                  "text": "Varm-op >5:39/km"
                },
                {
                  "duration": 1560,
                  "pace": {
                    "end": 84,
                    "start": 84,
                    "units": "%pace"
                  },
                  "text": "PROBE 5 km @ 5:15/km FAST — notér snit-puls"
                },
                {
                  "duration": 240,
                  "pace": {
                    "end": 88,
                    "start": 78,
                    "units": "%pace"
                  },
                  "text": "Base 5:00-5:38/km"
                },
                {
                  "duration": 300,
                  "pace": {
                    "end": 78,
                    "start": 65,
                    "units": "%pace"
                  },
                  "text": "Cool-down >5:39/km"
                }
              ]
            }
          }
        }
      ]
    },
    {
      "action": "set_day",
      "date": "2026-09-26",
      "entries": [
        {
          "id": "0d3d7bb7",
          "libraryId": "test_ftp20",
          "note": "FTP-TEST — indendørs, samme opsætning hver gang. IKKE ERG. Zoner sættes efter resultatet (set-zones.yml) · Flyttet fra tor 24/9. Tunge ben i opvarmningen → kør Grundtur i stedet og test i uge 41",
          "workout": {
            "description": "- Varm-op 10m ramp 45-70% FTP\n\n3x \n- Åbner 1m 100% FTP\n- Pause 1m 55% FTP\n\n- Let 5m 55% FTP\n- Sidste rolige minutter 5m 65% FTP\n- 20 MIN TEST — jævn maksindsats. Første 5 min skal føles for let. 20m freeride\n- Cool-down 7m ramp 60-40% FTP\n\nFORMÅL: Nulpunkt. Alt i biblioteket skalerer efter den. Køres indendørs, altid — samme trainer, samme blæseropsætning, samme tid på dagen.\n\n⚠ IKKE ERG-MODE — du styrer selv effekten.\n\nIKKE ERG — du skal selv styre effekten. Nyt FTP = 95% af 20-min snit. Begge blæsere på. Du undervurderer dig selv: læg ud 5 W over det du tror.",
            "moving_time": 3180,
            "name": "FaF 0 Test - FTP 20 min",
            "type": "Ride",
            "workout_doc": {
              "steps": [
                {
                  "duration": 600,
                  "power": {
                    "end": 70,
                    "start": 45,
                    "units": "%ftp"
                  },
                  "ramp": true,
                  "text": "Varm-op",
                  "warmup": true
                },
                {
                  "reps": 3,
                  "steps": [
                    {
                      "duration": 60,
                      "power": {
                        "end": 100,
                        "start": 100,
                        "units": "%ftp"
                      },
                      "text": "Åbner 100% FTP"
                    },
                    {
                      "duration": 60,
                      "power": {
                        "end": 55,
                        "start": 55,
                        "units": "%ftp"
                      },
                      "text": "Pause 55% FTP"
                    }
                  ],
                  "text": "3x"
                },
                {
                  "duration": 300,
                  "power": {
                    "end": 55,
                    "start": 55,
                    "units": "%ftp"
                  },
                  "text": "Let 55% FTP"
                },
                {
                  "duration": 300,
                  "power": {
                    "end": 65,
                    "start": 65,
                    "units": "%ftp"
                  },
                  "text": "Sidste rolige minutter 65% FTP"
                },
                {
                  "duration": 1200,
                  "text": "20 MIN TEST — jævn maksindsats. Første 5 min skal føles for let."
                },
                {
                  "cooldown": true,
                  "duration": 420,
                  "power": {
                    "end": 40,
                    "start": 60,
                    "units": "%ftp"
                  },
                  "ramp": true,
                  "text": "Cool-down"
                }
              ]
            }
          }
        }
      ]
    }
  ],
  "createdAt": "2026-09-22T08:00:00Z",
  "createdBy": "claude",
  "id": "2026-09-22-uge39-ftp-lor",
  "note": "Kennet har stive ben 2 dage efter CPH Half (PR). Gåtur tirsdag, Grundtur onsdag, probe torsdag, FTP-test lørdag. Kennets valg: lørdag frem for uge 41.",
  "status": "accepted",
  "summary": [
    "Tir 22/9: Grundtur 80 → Gåtur 45 min",
    "Ons 23/9: Probe → Grundtur 80",
    "Tor 24/9: FTP-test → Aerob probe",
    "Lør 26/9: Grundtur 80 → FTP-test"
  ],
  "title": "Uge 39: stive ben efter CPH Half — FTP-test flyttet til lør 26/9",
  "decidedAt": "2026-09-22T04:17:44+00:00",
  "result": {
    "dates_changed": [
      "2026-09-22",
      "2026-09-23",
      "2026-09-24",
      "2026-09-26"
    ],
    "commit": "9d6c407aa5ad789ae4e3579b7be0d3a9a2b27f5e"
  }
}
