{
  "changes": [
    {
      "action": "set_day",
      "date": "2026-11-01",
      "entries": [
        {
          "libraryId": "z2_grundtur_80",
          "note": "Genopbygning efter virus. Kør kun 45–50 min, lav Z2 (ca. 150–175 W), og stop før anden kadenceblok. Drop eller kør kun 30 min, hvis hvilepulsen er ≥2 slag over normal og HRV er lav, eller hvis pulsen stiger ved samme watt.",
          "workout": {
            "description": "- Varm-op 10m ramp 45-62% FTP\n- Zone 2 25m 66% FTP\n- Kadence 100 5m 70% FTP @ 100 rpm\n- Zone 2 25m 66% FTP\n- Kadence 100 5m 70% FTP @ 100 rpm\n- Cool-down 10m ramp 62-40% FTP\n\nFORMÅL: Ren zone 2. Skal føles kedeligt. Fundamentet under alt andet — og den enkeltfaktor der bedst forudsiger hvor lidt VO2max falder med alderen.",
            "moving_time": 4800,
            "name": "FaF 1 Z2 - Grundtur 80",
            "type": "Ride",
            "workout_doc": {
              "steps": [
                {
                  "duration": 600,
                  "power": {
                    "end": 62,
                    "start": 45,
                    "units": "%ftp"
                  },
                  "ramp": true,
                  "text": "Varm-op",
                  "warmup": true
                },
                {
                  "duration": 1500,
                  "power": {
                    "end": 66,
                    "start": 66,
                    "units": "%ftp"
                  },
                  "text": "Zone 2 66% FTP"
                },
                {
                  "cadence": {
                    "end": 100,
                    "start": 100,
                    "units": "rpm"
                  },
                  "duration": 300,
                  "power": {
                    "end": 70,
                    "start": 70,
                    "units": "%ftp"
                  },
                  "text": "Kadence 100 70% FTP"
                },
                {
                  "duration": 1500,
                  "power": {
                    "end": 66,
                    "start": 66,
                    "units": "%ftp"
                  },
                  "text": "Zone 2 66% FTP"
                },
                {
                  "cadence": {
                    "end": 100,
                    "start": 100,
                    "units": "rpm"
                  },
                  "duration": 300,
                  "power": {
                    "end": 70,
                    "start": 70,
                    "units": "%ftp"
                  },
                  "text": "Kadence 100 70% FTP"
                },
                {
                  "cooldown": true,
                  "duration": 600,
                  "power": {
                    "end": 40,
                    "start": 62,
                    "units": "%ftp"
                  },
                  "ramp": true,
                  "text": "Cool-down"
                }
              ]
            }
          }
        }
      ]
    }
  ],
  "createdAt": "2026-10-31T05:50:00+00:00",
  "createdBy": "claude",
  "id": "2026-10-31-soen-grundtur-fra-bibliotek",
  "note": "Retter forslag 2026-10-31-gang-i-dag-cykel-i-morgen: søndagens pas var ikke fra bike_library (regel 1). Grundtur 80 bruges, Kennet stopper efter 45–50 min.",
  "status": "accepted",
  "summary": [
    "Søn 1/11: FaF Z2 - Kælder 50 → Grundtur 80 (z2_grundtur_80), stop efter 45–50 min"
  ],
  "title": "Søn 1/11: Grundtur 80 fra biblioteket, stop efter 50 min",
  "decidedAt": "2026-10-31T05:49:13+00:00",
  "result": {
    "dates_changed": [
      "2026-11-01"
    ],
    "commit": "3abcf65b6537a92250f4f6da590cd804f4a31f35"
  }
}
