{
  "id": "2026-09-11-test-indbakke",
  "createdAt": "2026-09-11T11:45:00Z",
  "createdBy": "claude",
  "title": "Test af Outlook-indbakken: note på lør 3/10 (hjemrejse)",
  "note": "Første forslag sendt via kalender-indbakken (FAF-INBOX) — ingen Mac, ingen push. Ændrer kun noten på fridagen 3/10.",
  "summary": [
    "3/10: note — fri, hjemrejse fra Mallorca; gåtur hvis benene vil"
  ],
  "status": "accepted",
  "decidedAt": "2026-09-11T09:23:32+00:00",
  "result": {
    "dates_changed": [
      "2026-10-03"
    ],
    "commit": "3168d6a91cfffb03f7dbe7cd1322d5ca465726cf"
  },
  "changes": [
    {
      "date": "2026-10-03",
      "action": "set_day",
      "entries": [
        {
          "workout": null,
          "note": "Fri — hjemrejse fra Mallorca efter en 10-timers cykeluge. Gåtur hvis benene vil."
        }
      ]
    }
  ]
}
